Title,Authors,DOI,DOI link,Venue,Citation count,Year,Abstract summary
Department of Energy/University research: A smart partnership for a smart grid,P. Overholt,10.1109/PSCE.2009.4840103,https://doi.org/10.1109/PSCE.2009.4840103,IEEE PES Power Systems Conference and Exposition,2,2009,The Department of Energy is partnering with universities to develop advanced analytical tools and applications for smart grid operations.
166 15091 – Smart Buildings and Smart Grids 5 . 9 Human Machine Interaction in Energy Informatics,"H. Jacobsen, R. Katz, H. Schmeck, C. Goebel",-,-,-,0,2015,"The paper discusses human-machine interaction in smart grid operations, which is relevant to the query."
AAFGDES: A fuzzy expert system realization of Adaptive Autonomy using Gradient Descent,"M. Zamani, A. Fereidunian, M.A.A. Akhoundi, H. Lesani",10.1109/PTC.2011.6019402,https://doi.org/10.1109/PTC.2011.6019402,2011 IEEE Trondheim PowerTech,3,2011,A fuzzy expert system with gradient descent algorithm is used to determine the level of automation in human-automation interaction for smart grid operations.
A New Model for Industry–University Partnerships,"Jonathan Keck, Juneseok Lee",10.5942/JAWWA.2015.107.0161,https://doi.org/10.5942/JAWWA.2015.107.0161,-,22,2015,"This paper describes an industry-university partnership in the water industry, but does not address human-machine interaction in smart grid operations."
A Survey on Human Machine Interaction in Industry 4.0,"Christian Krupitzer, Sebastian Müller, Veronika Lesch, Marwin Züfle, Janick Edinger, Alexander Lemken, Dominik Schäfer, Samuel Kounev, C. Becker",-,-,arXiv.org,27,2020,"The paper surveys human-machine interaction in Industry 4.0, focusing on new paradigms that integrate augmented and virtual reality."
Organizational aspects for successful integration of human-machine interaction in the industry 4.0 era,"Eirin Lodgaard, Sebastian Dransfeld",10.1016/j.procir.2020.05.039,https://doi.org/10.1016/j.procir.2020.05.039,-,18,2020,"The paper discusses organizational aspects for successful integration of human-machine interaction in Industry 4.0, but does not specifically address industry-university partnerships or smart grid operations."
Cyber-Physical Security: A Game Theory Model of Humans Interacting Over Control Systems,"S. Backhaus, R. Bent, J. Bono, Ritchie Lee, Brendan D. Tracey, D. Wolpert, Dongping Xie, Y. Yildiz",10.1109/TSG.2013.2270291,https://doi.org/10.1109/TSG.2013.2270291,IEEE Transactions on Smart Grid,76,2013,The paper presents a game theory model to predict the interactions between intruders and system operators in smart grid cyber-physical security.
A Human-Machine Reinforcement Learning Method for Cooperative Energy Management,"Yuechuan Tao, Jing Qiu, Shuying Lai, Xian Zhang, Yunqi Wang, Guibin Wang",10.1109/tii.2021.3105115,https://doi.org/10.1109/tii.2021.3105115,IEEE Transactions on Industrial Informatics,21,2022,A human-machine reinforcement learning framework for cooperative energy management in smart grids.