Title,Authors,DOI,DOI link,Venue,Citation count,Year,Abstract summary
3DHOP: A Novel Technological Solution for the Development of Online Virtual Museums,"Marco Potenziani, M. Callieri, Roberto Scopigno",-,-,ERCIM News,3,2014,This paper does not contain industry case studies of automated decision support for energy system operators.
Context-based decision support for sustainable optimization of energy consumption,"M. Marques, B. Sučić, T. Vuk",-,-,-,3,2016,The paper presents a context-based decision support algorithm for optimizing energy consumption in industry.
Decision Support System for a Low Voltage Renewable Energy System,"Iulia Stamatescu, N. Arghira, I. Fagarasan, G. Stamatescu, S. Iliescu, V. Calofir",10.3390/EN10010118,https://doi.org/10.3390/EN10010118,-,34,2017,A decision support system was developed and tested for a low-voltage renewable energy microgrid to achieve energy balance.
Supporting Control Room Operators in Highly Automated Future Power Networks,"Minjiang Chen, V. Catterson, M. Syed, S. Mcarthur, G. Burt, M. Marinelli, A. Prostejovsky, K. Heussen",10.1049/OAP-CIRED.2017.1107,https://doi.org/10.1049/OAP-CIRED.2017.1107,-,5,2017,The paper investigates decision support functions for power system operators to handle frequency deviation events in highly automated future power networks.
Enhanced situational awareness and decision support for operators of future distributed power network architectures,"A. Zaher, V. Catterson, M. Syed, S. Mcarthur, G. Burt, Minjiang Chen, M. Marinelli, A. Prostejovsky",10.1109/ISGTEurope.2016.7856198,https://doi.org/10.1109/ISGTEurope.2016.7856198,IEEE PES Innovative Smart Grid Technologies Conference Europe,7,2016,The paper describes a control room decision support system for future power network operators to aid in restoring frequency during incidents.
An Automated Fault Location System as a Decision Support Tool for System Operators,"J. Vasco, R. Ramlachan, J. Wong, Lee Wang",10.1109/CPRE.2008.4515080,https://doi.org/10.1109/CPRE.2008.4515080,2008 61st Annual Conference for Protective Relay Engineers,5,2008,An automated fault location system can provide system operators with accurate fault information to optimize their decision-making process.
Automatic decision support with a new visualization concept for power systems,"E. Handschin, C. Leder",10.1109/PTC.2001.964758,https://doi.org/10.1109/PTC.2001.964758,2001 IEEE Porto Power Tech Proceedings (Cat. No.01EX502),7,2001,A new visualization concept provides automated decision support for power system operators by reducing data complexity and suggesting control actions.
Implementing Industry 4.0: An In-Depth Case Study Integrating Digitalisation and Modelling for Decision Support System Applications,"Akshay Ranade, Javier Gómez, Andrew de Juan, William D. Chicaiza, Michael Ahern, J. M. Escaño, A. Hryshchenko, Olan Casey, Aidan Cloonan, D. O’Sullivan, Ken Bruton, Alan Mcgibney",10.3390/en17081818,https://doi.org/10.3390/en17081818,Energies,1,2024,"The paper presents a case study of implementing Industry 4.0 technologies, including data-driven decision support systems, to enhance energy efficiency in a manufacturing process."