Title,Authors,DOI,DOI link,Venue,Citation count,Year,Abstract summary
Tacit Knowledge Elicitation for Shop-floor Workers with an Intelligent Assistant,"Samuel Kernan Freire, Chaofan Wang, Santiago Ruiz-Arenas, E. Niforatos",10.1145/3544549.3585755,https://doi.org/10.1145/3544549.3585755,CHI Extended Abstracts,3,2023,An intelligent assistant system can support the elicitation of tacit knowledge from workers through systematic reflection.
Tacit knowledge elicitation process for industry 4.0,"Enzo Fenoglio, Emre Kazim, Hugo Latapie, A. Koshiyama",10.1007/s44163-022-00020-w,https://doi.org/10.1007/s44163-022-00020-w,Discover Artificial Intelligence,8,2021,The paper proposes a tacit knowledge elicitation process for capturing operational best practices of experienced workers in industrial domains for Industry 4.0.
Federated AI Chat System: Tackling Tacit Knowledge Management,"J. Seo, B. Cui, C. Rong",10.3997/2214-4609.202410298,https://doi.org/10.3997/2214-4609.202410298,85th EAGE Annual Conference &amp; Exhibition (including the Workshop Programme),0,2024,A federated AI system named GPTWell is proposed to manage tacit knowledge in the oil and gas sector.
A Tacit-Knowledge-Based Requirements Elicitation Model Supporting COVID-19 Context,"Hamnah Anwar, Saif Ur Rehman Khan, J. Iqbal, Adnan Akhunzada",10.1109/ACCESS.2022.3153678,https://doi.org/10.1109/ACCESS.2022.3153678,IEEE Access,3,2022,"The paper proposes a conceptual model to effectively elicit tacit knowledge-based requirements in software development, particularly during the COVID-19 pandemic."
INFLUENCE FACTORS OF THE TACIT KNOWLEDGE ELICITATION PROCESS: SYSTEMATIC LITERATURE REVIEW,"Cláudio Roberto do Rosário, Fernando Gonçalves do Amaral",10.47916/ijkem-vol9n25-2020-83301,https://doi.org/10.47916/ijkem-vol9n25-2020-83301,International journal of knowledge engineering and management,0,2021,"This paper reviews factors influencing the process of tacit knowledge elicitation, but does not specifically address challenges in the context of AI systems and DER operations."
Capturing tacit knowledge for spacecraft operations at ESOC,"R. Mugellesi-dow, S. Pallaschke, Oriol Gallemi Rovira",-,-,-,4,2009,"The paper discusses the challenges in capturing tacit knowledge from experts for spacecraft operations, but does not specifically address AI systems or DER operations."
Integration of DERs on power systems: challenges and opportunities,T. Román,10.2139/SSRN.2919287,https://doi.org/10.2139/SSRN.2919287,-,78,2017,"The paper discusses the challenges and opportunities in integrating distributed energy resources (DERs) into power systems, but does not specifically address tacit knowledge elicitation for AI systems in DER operations."
Capturing Tacit Knowledge in Security Operation Centers,"Selina Y. Cho, J. Happa, S. Creese",10.1109/ACCESS.2020.2976076,https://doi.org/10.1109/ACCESS.2020.2976076,IEEE Access,15,2020,"This paper examines the use of tacit knowledge by security analysts in security operations centers, but does not address challenges in tacit knowledge elicitation for AI systems in DER operations."