Title,Authors,DOI,DOI link,Venue,Citation count,Year,Abstract summary
Literature Research on the Use and Requirements of Datagram Communication and Protocols in AAS and Digital Twins,"Alfred Barnard, Melanie Stolze",10.1109/ICECET58911.2023.10389431,https://doi.org/10.1109/ICECET58911.2023.10389431,"2023 International Conference on Electrical, Computer and Energy Technologies (ICECET)",0,2023,The paper explores the use and requirements of datagram communication and protocols in Asset Administration Shells and Digital Twins.
The Role of Multi-Agents in Digital Twin Implementation: Short Survey,"Y. Kalyani, Rem Collier",10.1145/3697350,https://doi.org/10.1145/3697350,ACM Computing Surveys,2,2024,"The paper explores the role of multi-agent systems in implementing digital twins, but does not specifically address research gaps in agent communication protocols for expertise modeling digital twins."
The Paradigm of Digital Twin Communications,"T. Luan, Ruhan Liu, Longxiang Gao, Rui Li, Haibo Zhou",-,-,arXiv.org,40,2021,"The paper discusses the communication framework for digital twins, which is an open research issue."
On the Integration of Agents and Digital Twins in Healthcare,"Angelo Croatti, Matteo Gabellini, Sara Montagna, A. Ricci",10.1007/s10916-020-01623-5,https://doi.org/10.1007/s10916-020-01623-5,Journal of medical systems,179,2020,"The paper discusses the integration of agents and digital twins in healthcare, but does not specifically address research gaps related to agent communication protocols for expertise modeling digital twins."
Towards Fusing Data and Expert Knowledge for Better-Informed Digital Twins: An Initial Framework,"Michelle Jungmann, Sanja Lazarova-Molnar",10.1016/j.procs.2024.06.072,https://doi.org/10.1016/j.procs.2024.06.072,Procedia Computer Science,0,2024,"The paper proposes a framework for integrating expert knowledge and data to improve Digital Twin model extraction, identifying challenges and opportunities in this area."
Characterising the Digital Twin: A systematic literature review,"D. Jones, C. Snider, Aydin Nassehi, J. Yon, B. Hicks",10.1016/j.cirpj.2020.02.002,https://doi.org/10.1016/j.cirpj.2020.02.002,CIRP - Journal of Manufacturing Science and Technology,1204,2020,"This paper identifies research gaps in digital twin characterization, including technical implementations and integration between virtual entities, but does not specifically address agent communication protocols for expertise modeling."
Expert Twin: A Digital Twin with an Integrated Fuzzy-Based Decision-Making Module,"Gergő Dávid Monek, Szabolcs Fischer",10.31181/dmame8120251181,https://doi.org/10.31181/dmame8120251181,Decision Making: Applications in Management and Engineering,3,2024,The paper presents an 'Expert Twin' digital twin framework that integrates fuzzy-based decision-making to enhance manufacturing process optimization and decision support.
An Agent-Directed Digital Twin Framework for Simulation-Based Training,"A. Lektauers, J. Bikovska, Vitālijs Boļšakovs",10.1109/ITMS56974.2022.9937103,https://doi.org/10.1109/ITMS56974.2022.9937103,International Scientific Conference Information Technology and Management Science Riga Technical University,2,2022,"The paper presents an agent-directed digital twin framework for simulation-based training, but does not discuss research gaps related to agent communication protocols for expertise modeling digital twin."